<xml version-"1.0">
<!ELEMENT QUIZ (QUESTION*)>
<!ELEMENT QUESTION (ASK+,CHOICE*,ANSWER+,RESPONSE+)>
<!ATTLIST QUESTION
  TYPE CDATA #REQUIRED>

<!ELEMENT ASK (#PCDATA)>
<!ELEMENT CHOICE EMPTY>
    <!ATTLIST CHOICE
         VALUE CDATA #REQUIRED
         TEXT CDATA #REQUIRED>
<!ELEMENT ANSWER (#PCDATA)>
<!ELEMENT RESPONSE (#PCDATA)>
    <!ATTLIST RESPONSE
         VALUE CDATA
         STATUS CDATA>
